place_id,name,address,city,province,postal_code,phone,website,category,capacity_min,capacity_max,coordinator_name,coordinator_email,coordinator_phone,venue_type,catering,accommodations,indoor_outdoor,rating,review_count,google_closed,has_weddings_page,weddings_page_url,has_packages,packages,has_pricing,has_testimonials,booking_platform,instagram_handle,wedding_readiness_score,score_reasoning,description,source,scraped_at,enriched_at
ChIJuT-0QCpT04kRrtfTojqxj6Y,Little Barn Co. Weddings,"1923 Seventh Street Louth, St. Catharines, ON L2R 6P9, Canada",St. Catharines,ON,L2R 6P9,,https://www.littlebarncoweddings.ca/,Wedding Venue,,,,,,farm,unknown,nearby,both,5,5,no,yes,https://www.littlebarncoweddings.ca,unknown,,no,unknown,,,95,"Premier wedding venue with 'Weddings' in business name and domain, dedicated website focused exclusively on hosting weddings at a rustic flower farm with barn and full-service amenities.","A rustic flower farm wedding venue in St. Catharines featuring blooming peony fields, a beautiful barn, and full amenities minutes from Niagara wine country.",google_places,2026-05-17T23:11:55.768654+00:00,2026-05-18T01:02:48.191777+00:00
ChIJt2TqMqL5KYgRiyqvyx1dna0,Clockworks Weddings & Events,"457200 8th Concession Rd S, Chatsworth, ON N4K 5N8, Canada",Meaford,ON,N4K 5N8,,https://www.clockworksevents.ca/,Wedding Venue,,,,,,other,unknown,unknown,unknown,5,5,no,yes,https://www.clockworksevents.ca,unknown,,no,unknown,,,95,"The entire website is dedicated to weddings with 'Create Your Dream Wedding Today' as the main title and meta description explicitly stating they specialize in crafting timeless, elegant wedding experiences.","Clockworks in Chatsworth, Ontario specializes in crafting timeless, elegant wedding experiences with meticulous attention to detail for your dream day.",google_places,2026-05-18T00:10:22.040985+00:00,2026-05-18T03:39:40.509604+00:00
ChIJY0_nuwWt1EwRbkeTq1WqxGo,Pondview Estates Wedding Venue,"2440 N Asphodel 5th Line, Norwood, ON K0L 2V0, Canada",Norwood,ON,K0L 2V0,(705) 931-5123,http://www.pondviewestates.com/,Wedding Venue,,,,,,estate,unknown,unknown,outdoor,5,5,no,yes,https://www.pondviewestates.com/weddings,unknown,,no,unknown,,,92,"Dedicated weddings page with SEO-optimized title 'Plan Your Dream Wedding Today' and meta description emphasizing expert planning, decor, and stress-free wedding experiences clearly positions this as a premier wedding venue.",Pondview Estates is a beautiful outdoor wedding venue offering expert planning and stunning decor for your dream celebration. Experience stress-free weddings.,google_places,2026-05-18T00:04:17.211650+00:00,2026-05-18T03:26:59.886828+00:00
ChIJ-zVc1n7RKogRgm5gW8IxqHc,Bancroft Polo Farm Wedding Venue,"16555 Keele St, Kettleby, ON L7B 0G1, Canada",Kettleby,ON,L7B 0G1,(647) 444-3268,https://www.bancroftpolofarmweddings.com/,Wedding Venue,,,,,,farm,unknown,unknown,unknown,5,1,no,yes,https://www.bancroftpolofarmweddings.com,no,,no,no,,,92,"Dedicated wedding venue with 'weddings' in domain name and brand, 130-acre polo farm estate specifically marketed for weddings with professional meta descriptions highlighting its wedding purpose.","A stunning 130-acre polo farm estate in Kettleby, just 30 minutes north of Toronto, offering breathtaking horse country views for weddings and celebrations.",google_places,2026-05-17T23:32:32.353716+00:00,2026-05-18T02:01:37.655165+00:00
ChIJxd54n3cP0kwRsu5ccpYcWNA,The Ranch Weddings and Events,"7109 County Rd 29, Carleton Place, ON K7C 3P1, Canada",Carleton Place,ON,K7C 3P1,(613) 695-7123,https://www.ranchweddingsandevents.ca/,Wedding Venue,,,,,,barn,unknown,unknown,unknown,5,1,no,yes,https://www.ranchweddingsandevents.ca/,no,,no,no,,,92,"The venue name itself is 'Ranch Weddings & Events' with weddings prominently featured in the business name and domain, indicating a dedicated wedding venue.",A ranch-style wedding and events venue offering a rustic setting for your celebration. Perfect for couples seeking a countryside atmosphere for their special day.,google_places,2026-05-18T00:07:31.690705+00:00,2026-05-18T03:33:09.061990+00:00
ChIJjQQolqwTL4gRVqfds2488_I,Fallowfield Estate,"7129 Arkona Rd, Arkona, ON N0M 1B0, Canada",Arkona,ON,N0M 1B0,(519) 466-1177,http://fallowfieldestate.ca/,Wedding Venue,,,,,,estate,in-house only,unknown,both,5,1,no,yes,http://fallowfieldestate.ca/,unknown,,no,unknown,,,95,"Premier wedding venue with dedicated focus evident in page title mentioning tent and barn wedding reception venue, catering, event planning, and DJs for weddings.","A romantic barn and tent wedding venue in Fallowfield featuring rustic charm with modern interiors. Full-service estate offering catering, event planning, and entertainment.",google_places,2026-05-17T23:59:14.899400+00:00,2026-05-18T03:08:37.768638+00:00
ChIJ7ZT_-gPjL4gRwly2jSFa0Qo,Meadowcroft Estate,"9255 Old Street Line, Blenheim, ON N0P 1A0, Canada",Blenheim,ON,N0P 1A0,(519) 355-9990,https://meadowcroftestate.com/,Wedding Venue,,,,,,estate,unknown,unknown,unknown,,,no,yes,https://www.meadowcroftestate.com/weddings,yes,"Packages for elopements, micro weddings, and small weddings",no,no,,,92,"Dedicated weddings page with clear focus on elopements, micro weddings, and small weddings, mentions packages and services, and is branded as an estate venue.","Meadowcroft Estate specializes in intimate celebrations with scenic settings perfect for elopements, micro weddings, and small gatherings.",google_places,2026-05-17T23:54:05.299995+00:00,2026-05-18T02:57:36.753854+00:00
ChIJnSXAiWP8KYgRQCgSiKDdJ6M,Wedding on the Bay,"1800 2nd Ave E, Owen Sound, ON N4K 5R1, Canada",Owen Sound,ON,N4K 5R1,(866) 719-9200,http://weddingsonthebay.ca/,Wedding Venue,,,,,,hotel,unknown,yes,unknown,,,no,yes,http://weddingsonthebay.ca/wedding-packages,yes,"Wedding packages available, customizable options",no,no,,@bestwesterninnonthebay,92,"Dedicated wedding website with packages page, hotel venue with accommodations, waterfront location, and clear wedding focus in branding and meta content.",Waterfront hotel venue in Owen Sound offering customizable wedding packages on Georgian Bay. Features on-site accommodations and elegant lakeside setting.,google_places,2026-05-18T00:10:27.635272+00:00,2026-05-18T03:40:22.101798+00:00
