place_id,name,address,city,province,postal_code,phone,website,category,capacity_min,capacity_max,coordinator_name,coordinator_email,coordinator_phone,venue_type,catering,accommodations,indoor_outdoor,rating,review_count,google_closed,has_weddings_page,weddings_page_url,has_packages,packages,has_pricing,has_testimonials,booking_platform,instagram_handle,wedding_readiness_score,score_reasoning,description,source,scraped_at,enriched_at
ChIJgYSjNwA104kRLjl5Is8Ozf4,Kehoe & Kin - Niagara Wedding Barn Venue,"31684 Dixie Rd, Wainfleet, ON L0S 1V0, Canada",Wainfleet,ON,L0S 1V0,,https://www.kehoeandkin.com/,Wedding Venue,130,200,,,,barn,unknown,unknown,both,4.9,137,no,yes,https://www.kehoeandkin.com,no,,no,no,,,92,"Premier wedding barn venue with explicit wedding focus in meta description, clear capacity stated (130 seated, 200 standing), restored century barn with photography features and copper cupola specifically positioned for weddings.",Century-old restored barn in Niagara with three levels perfect for photography. Seats 130 for dinner or 200 standing with country chic farm backdrop.,google_places,2026-05-17T23:04:43.882465,2026-05-18T00:54:25.133089+00:00
ChIJZ5c0x_kcL4gRfIuS8CULIYQ,Century Wedding Barn,"10068 Fernhill Dr, Denfield, ON N0M 1P0, Canada",Denfield,ON,N0M 1P0,(519) 476-9300,http://centuryweddingbarn.ca/,Wedding Venue,,,,,,barn,unknown,unknown,unknown,4.1,127,no,yes,http://centuryweddingbarn.ca/,no,,no,no,,,92,The venue name itself is 'Century Wedding Barn' and the tagline is 'Happily ever after begins here' - this is clearly a dedicated wedding venue with weddings as its primary business focus.,The Century Wedding Barn offers a rustic barn setting where happily ever after begins. A dedicated wedding venue perfect for couples seeking countryside charm.,google_places,2026-05-17T23:52:46.344022+00:00,2026-05-18T02:47:33.424571+00:00
ChIJkUOU_EwbK4gRc8zLDj2XTJ4,MG Manor,"15930 St Andrews Rd, Caledon East, ON L7C 2R8, Canada",Caledon East,ON,L7C 2R8,(437) 788-2525,https://mgmanor.com/,Wedding Venue,,,,,,estate,unknown,unknown,both,3.9,104,no,yes,https://mgmanor.com/,no,,no,no,,,92,"Premier luxury wedding venue with weddings prominently featured in title and description, set on a 200-acre private estate with both elegant indoor spaces and outdoor tent options.","MG Manor is a luxury wedding venue on a private 200-acre estate in Caledon, Ontario, offering elegant indoor spaces and a stunning outdoor tent for unforgettable celebrations.",google_places,2026-05-17T23:28:57.582303+00:00,2026-05-18T01:50:08.849602+00:00
ChIJz8Nqka-vKk0RjMLlJJWKbVU,Northbrook Farm Weddings,"3952 Fairgrounds Rd, Severn, ON L3V 0Y2, Canada",Aurora,ON,L3V 0Y2,(705) 330-5600,http://northbrookfarmweddings.ca/,Wedding Venue,,,,,,farm,unknown,unknown,outdoor,4.9,99,no,yes,https://northbrookfarmweddings.ca/,no,,no,no,,,95,Domain name is 'northbrookfarmweddings.ca' and site name is 'Northbrook Farm Weddings & Events' with meta description explicitly marketing it as 'the premier wedding venue in Orillia' - this is a dedicated wedding venue.,Northbrook Farm is Orillia's premier outdoor wedding venue featuring stunning gardens and elegant spaces. An elevated farm experience for your special day.,google_places,2026-05-17T23:32:56.010710+00:00,2026-05-18T02:01:58.790866+00:00
ChIJ3WBut3Nf04kRUt86mie2LeY,The Gardens at Pillar and Post,"526 Regent St, Niagara-on-the-Lake, ON L0S 1J0, Canada",Niagara-on-the-Lake,ON,L0S 1J0,(905) 468-2123,https://www.vintage-hotels.com/pillar-and-post/the-gardens-at-pillar-and-post/?utm_source=google&utm_medium=organic&utm_campaign=Google+My+Business&utm_term=The+Gardens&utm_content=Website,Wedding Venue,,,,,,hotel,unknown,yes,outdoor,4.6,91,no,yes,https://www.vintage-hotels.com/pillar-and-post/the-gardens-at-pillar-and-post/,no,,no,no,,,92,"Premier wedding venue at an established boutique hotel with dedicated Gardens page specifically mentioning weddings as a primary use, Monet-inspired setting, and clear event infrastructure.",Monet-inspired gardens at the prestigious Pillar and Post hotel offering an elegant outdoor setting for romantic weddings and special celebrations in Niagara-on-the-Lake.,google_places,2026-05-17T23:04:39.577494,2026-05-18T00:53:04.689636+00:00
ChIJwygkufVnLogRRQNFsgmUlfc,Wheatfield Estate,"5277 Quaker Rd, Sparta, ON N0L 2H0, Canada",Sparta,ON,N0L 2H0,,http://www.wheatfieldestate.com/,Wedding Venue,,,,,,estate,unknown,unknown,outdoor,4.8,90,no,yes,https://wheatfieldestate.com/weddings,yes,Investment guide with multiple packages and add-ons available,yes,unknown,,,92,"Dedicated weddings page with clear investment guide, packages, FAQ section, and detailed planning resources on a 5-acre forest estate venue near Port Stanley.",Beautiful outdoor wedding venue on 5 acres of forest near charming Port Stanley. Host your dream celebration in this intimate natural setting with packages.,google_places,2026-05-17T23:18:02.163171+00:00,2026-05-18T01:16:47.156032+00:00
ChIJ6xbawoSL1YkR7Kt0KWmPbjk,Northview Gardens~ Wedding & Event Venue,"994 Peterborough County Rd 19, Peterborough, ON K9J 6X2, Canada",Peterborough,ON,K9J 6X2,(705) 768-9742,http://www.northviewgardens.ca/,Wedding Venue,,,,,,estate,unknown,unknown,both,4.6,81,no,yes,https://www.northviewgardens.ca/wedding-packages,yes,Wedding packages available - details on dedicated packages page,no,no,,,92,"Premier wedding venue with 'Wedding & Event Venue' in business name, dedicated wedding packages page, and clear wedding focus in site structure and branding.",Northview Gardens is a dedicated wedding and event venue offering customizable wedding packages in a beautiful garden setting. Perfect for couples seeking both indoor and outdoor ceremony and reception options.,google_places,2026-05-18T00:04:14.321386+00:00,2026-05-18T03:26:42.229834+00:00
ChIJzXSewCujLIgRlwE0nO5B2LM,Agape Garden Event Venue,"410 Lewis Rd Unit 4, Stoney Creek, ON L8E 5Y7, Canada",Hamilton,ON,L8E 5Y7,(416) 575-1925,https://www.agapegarden.ca/,Wedding Venue,,,,info@agapegarden.ca,+14165751925,estate,unknown,unknown,both,4.9,73,no,yes,https://www.agapegarden.ca/,unknown,,no,no,,@agapegardeneventvenue,95,"Premier wedding venue with weddings prominently featured in title, meta description, and schema markup as EventVenue specializing in micro weddings and intimate ceremonies.","Agape Garden is Hamilton's premier boutique event venue blending rustic charm with sophisticated elegance, specializing in micro weddings and intimate ceremonies.",google_places,2026-05-17T23:16:30.967300+00:00,2026-05-18T01:12:00.560317+00:00
ChIJMTbjZBht0kwRQi9zErXn-lg,Temple's Country Weddings,"1700 Ferguson Falls Rd, Lanark, ON K0G 1K0, Canada",Lanark,ON,K0G 1K0,(613) 253-7000,https://templescountryweddings.ca/?utm_source=google&utm_medium=organic&utm_campaign=gbp-listing,Wedding Venue,,,,,,barn,unknown,unknown,both,4.9,70,no,yes,https://templescountryweddings.ca/,no,,no,no,,,95,"Premier wedding venue with 'weddings' in business name, dedicated wedding website, and SEO optimized specifically as 'Country Wedding Venue Ottawa Valley' with romantic countryside positioning.","Romantic country wedding venue in Ottawa Valley featuring towering trees, warm timber beams, and countryside charm for an unforgettable celebration.",google_places,2026-05-18T00:00:20.319542+00:00,2026-05-18T03:11:27.601212+00:00
ChIJtzxlMxiVKogR49FZ4OV_yqI,Ivy Ridge Weddings & Events,"7511 9th Line, Thornton, ON L0L 2N0, Canada",Thornton,ON,L0L 2N0,(705) 730-9876,https://ivyridge.ca/,Wedding Venue,,,,,,barn,unknown,unknown,both,4.9,67,no,yes,https://ivyridge.ca/weddings,unknown,,no,yes,,,92,"Premier wedding venue with 'Weddings & Events' in business name, dedicated weddings page with detailed subsections for ceremony, terrace, loft, culinary, and bookings, plus testimonials and book-a-tour functionality.","Ivy Ridge offers historic charm for your dream wedding with ceremony spaces, terrace, and loft options. Celebrate in a beautifully restored setting designed for couples.",google_places,2026-05-17T23:32:52.904907+00:00,2026-05-18T02:01:45.898011+00:00
ChIJZbsDO9BJ04kRrzFoJ_ZMknY,Ovation Ballroom,"1311 Egerter Rd, Port Robinson, ON L0S 1K0, Canada",Thorold,ON,L0S 1K0,(905) 384-5002,http://ovationballroom.com/,Wedding Venue,,,,,,banquet hall,unknown,unknown,indoor,4.8,66,no,yes,http://ovationballroom.com/,no,,no,no,,,95,This is explicitly branded as 'Niagara's Newest Wedding Venue' in the page title and company name 'Ovation Ballroom' clearly indicates a dedicated wedding venue.,"Ovation Ballroom is Niagara's newest wedding venue, offering couples an elegant ballroom setting for their celebration. A dedicated space designed for weddings.",google_places,2026-05-17T23:13:31.004264+00:00,2026-05-18T01:03:18.285218+00:00
ChIJN93_QSHZzUwR3ltkIqnioIE,Ottawa Wedding Chapel,"3249 York's Corners Rd, Kenmore, ON K0A 2G0, Canada",Ottawa,ON,K0A 2G0,(800) 545-3681,http://ottawaweddingchapel.org/,Wedding Venue,,,,,,other,unknown,unknown,indoor,4.9,63,no,yes,http://ottawaweddingchapel.org/wedding-packages,yes,Multiple wedding packages available for ceremony,no,no,,,95,This is literally a dedicated wedding chapel with 'wedding' in its name and an entire page devoted to wedding packages - premier wedding-focused venue.,Ottawa Wedding Chapel is a dedicated ceremony venue offering multiple wedding packages. The perfect intimate setting for your special day in Ottawa.,google_places,2026-05-18T00:00:24.629523+00:00,2026-05-18T03:12:23.748522+00:00
ChIJ86zz1NO114kRu8na6mkghnk,Cherryvale Weddings,"1927 County Rd 10, Picton, ON K0K 2T0, Canada",Belleville,ON,K0K 2T0,,http://www.cherryvaleweddings.ca/,Wedding Venue,,,,,,other,unknown,unknown,unknown,4.9,62,no,yes,http://www.cherryvaleweddings.ca/,no,,no,no,,,95,"Domain name and branding explicitly dedicated to weddings (Cherryvale Weddings), indicating this is a premier purpose-built wedding venue.","Cherryvale Weddings is a dedicated wedding venue designed to host your special day. With weddings as their primary focus, they provide a specialized setting for couples.",google_places,2026-05-18T00:03:07.662644+00:00,2026-05-18T03:23:22.486269+00:00
ChIJkb5Go0pGK4gRFjm0MsNoY38,Coach House Weddings,"15134 County Rd 21, Brighton, ON K0K 1H0, Canada",Brighton,ON,K0K 1H0,(905) 616-5454,http://www.coachhouseweddings.com/,Wedding Venue,,50,"John Marchant, Andrea Marchant",,,barn,unknown,yes,both,5,53,no,yes,http://www.coachhouseweddings.com/weddings,yes,"Micro weddings, all inclusive, pop-up weddings",no,no,,,92,"Dedicated wedding venue with 'weddings' in domain name, offers micro weddings up to 50 guests in barn and courtyard settings with guest house accommodations and named coordinators.",Intimate barn and courtyard wedding venue specializing in elegant micro weddings for up to 50 guests. Features guest house accommodations for 6 and all-inclusive packages in Prince Edward County.,google_places,2026-05-18T00:02:22.116268+00:00,2026-05-18T03:19:02.238347+00:00
ChIJ___7F41E04kRZgG4bSy0qbY,Niagara Wedding Chapel,"7973 Lundy's Ln, Niagara Falls, ON L2H 1H3, Canada",Niagara Falls,ON,L2H 1H3,(800) 393-7270,http://niagaraweddingchapel.com/,Wedding Venue,,,,,,other,unknown,unknown,unknown,4.9,53,no,yes,https://www.niagaraweddingchapel.com/wedding-packages,yes,"Elopements, intimate weddings, vow renewals, commitment ceremonies",no,no,,,95,"This is a dedicated wedding chapel with 'wedding' in its name, specialized packages for elopements and intimate ceremonies, and wedding-specific metadata including detailed keywords for wedding photography, flowers, and Elvis ceremonies.","Intimate wedding chapel in Niagara Falls specializing in elopements, small weddings, and vow renewals. Offers all-inclusive packages with photography and flowers.",google_places,2026-05-17T23:04:45.060439,2026-05-18T00:54:37.987317+00:00
ChIJ-YOOBXnxL4gRwl_n-Bu2LFE,The Rustic Ranch Wedding & Event Barn,"11369 Longwoods Rd, Thamesville, ON N0P 2K0, Canada",Thamesville,ON,N0P 2K0,(226) 881-0430,https://www.therusticranchbarn.com/,Wedding Venue,,,,,,barn,unknown,unknown,unknown,4.9,53,no,yes,https://www.therusticranchbarn.com,unknown,,no,unknown,,,95,"The venue name explicitly includes 'Wedding & Event Barn' and the site description states it's a luxury barn wedding venue hosting stress-less weddings since 2016, demonstrating clear wedding specialization.","The Rustic Ranch is a luxury barn wedding venue near Chatham, Ontario, specializing in stress-less weddings since 2016. Original barn venue for couples.",google_places,2026-05-17T23:53:45.666337+00:00,2026-05-18T02:55:02.129378+00:00
ChIJ20Zn9zUBKogRK1YNi9F8wug,The Best Little Wedding Chapel,"517831 Concession 5N, Owen Sound, ON N4K 5W4, Canada",Owen Sound,ON,N4K 5W4,(289) 952-7509,http://www.thebestlittleweddingchapel.com/,Wedding Venue,,,,,,barn,unknown,unknown,both,5,52,no,yes,https://thebestlittleweddingchapel.com/weddings-ceremonies/,yes,"Micro wedding packages focused on affordable, intimate ceremonies",no,no,,@thebestlittleweddingchapel,95,"Dedicated wedding chapel and barn venue with weddings as primary business, micro wedding packages, and clear specialization in intimate ceremonies.","A charming chapel and barn venue in South Georgian Bay specializing in affordable micro weddings and intimate ceremonies for couples seeking a beautiful, unique setting.",google_places,2026-05-17T23:40:40.167324+00:00,2026-05-18T02:19:55.294055+00:00
ChIJ3eaLmH3DOogRXTDx75OMBQc,Kings Landing Events,"455 Seacliff Dr, Kingsville, ON N9Y 2K5, Canada",Kingsville,ON,N9Y 2K5,(647) 971-3042,http://kingslandingevents.com/,Wedding Venue,,,,,,winery,unknown,unknown,unknown,5,50,no,yes,https://kingslandingevents.com,no,,no,no,,,92,"Premier wedding venue with 'Wedding' in the page title, described as 'premier event venue' at Pelee Island Winery with explicit focus on weddings, elegant space, and impeccable service.",Kings Landing Events at Pelee Island Winery offers an elegant waterfront setting in Kingsville with exquisite cuisine and impeccable service for your wedding.,google_places,2026-05-17T23:53:28.978786+00:00,2026-05-18T02:54:09.160600+00:00
ChIJ2dv_-tA30UwRKu_xFjFla2Y,The Farmstead Weddings & Events,"530 Drive-in Rd, Pembroke, ON K8A 6W4, Canada",Pembroke,ON,K8A 6W4,(613) 401-6958,http://www.thefarmstead.ca/,Wedding Venue,,,,,,farm,unknown,unknown,unknown,4.9,47,no,yes,https://www.thefarmstead.ca/weddings,yes,"Full-weekend, weekday, and seasonal micro-wedding packages available",no,no,,,92,"Premier wedding venue with 'Weddings & Events' in business name, dedicated weddings page, and multiple wedding packages including full-weekend and micro-wedding options clearly marketed.","The Farmstead Weddings & Events offers versatile farm wedding packages including full-weekend celebrations, weekday events, and intimate seasonal micro-weddings.",google_places,2026-05-17T23:45:19.241041+00:00,2026-05-18T02:31:54.963358+00:00
ChIJg093GUol1okRpPSjCxE_0mg,Venue 1906,"34 Victoria Ave, Belleville, ON K8N 1Z4, Canada",Belleville,ON,K8N 1Z4,(613) 902-8130,https://www.venue1906.ca/,Wedding Venue,,,,,,banquet hall,unknown,unknown,indoor,4.8,46,no,yes,https://www.venue1906.ca/weddings,no,,no,no,,,92,"Dedicated weddings page with venue explicitly branded as 'Wedding & Events Space' in the site title, former church offering both ceremonies and receptions in Belleville, Ontario.","Former church converted into a beautiful banquet hall in Belleville, hosting both ceremonies and receptions. A unique heritage venue perfect for traditional or modern weddings.",google_places,2026-05-18T00:02:13.733360+00:00,2026-05-18T03:18:00.553288+00:00
ChIJn3b7z5qbLIgRWvkuQeBqtd0,Heritage Weddings & Coordinators,"98 St Clair Ave, Hamilton, ON L8M 2N5, Canada",Hamilton,ON,L8M 2N5,(905) 528-3975,http://heritageweddings.ca/,Wedding Venue,,,,,,other,unknown,unknown,unknown,4.7,44,no,yes,http://heritageweddings.ca/,no,,no,no,,,95,The business name 'Heritage Weddings & Coordinators' explicitly identifies this as a dedicated wedding coordination service with weddings as the primary business focus.,Heritage Weddings & Coordinators specializes in wedding planning and coordination services. Professional wedding expertise to help couples plan their perfect day.,google_places,2026-05-17T23:20:40.377532+00:00,2026-05-18T01:21:23.462126+00:00
ChIJk6b8PY4hO4gRk-f1slsaDts,Wedding in the Woods,"1241 S Malden Rd, Essex, ON N9V 2Y7, Canada",Essex,ON,N9V 2Y7,(519) 984-3993,http://www.weddinginthewoods.ca/,Wedding Venue,,,,,,other,unknown,unknown,outdoor,4.7,39,no,yes,http://www.weddinginthewoods.ca/wedding,no,,no,no,,,95,"Premier dedicated wedding venue with 'Wedding' literally in the business name, dedicated weddings page, and metadata describing itself as an enchanting rustic private wedding venue on 30 acres.","Enchanting rustic private wedding venue on 30 acres of natural beauty in Windsor-Essex, 10-20 minutes from Windsor, Tecumseh, Amherstburg, Kingsville and Lasalle.",google_places,2026-05-17T23:52:58.656301+00:00,2026-05-18T02:48:26.016180+00:00
ChIJqwDRmasuO4gRvB5Txay4cJ4,Windsor Weddings,"2418 Central Ave, Windsor, ON N8W 4J3, Canada",Windsor,ON,N8W 4J3,(519) 990-4307,http://www.windsorweddings.ca/,Wedding Venue,,,,,,other,unknown,unknown,unknown,5,38,no,yes,http://www.windsorweddings.ca/,unknown,,no,no,,,95,The business name is literally 'Windsor Weddings' with tagline 'YOUR WEDDING. YOUR WAY. EFFORTLESS.' indicating this is a dedicated wedding service or venue focused entirely on the wedding market.,"Windsor Weddings specializes in creating effortless, personalized wedding experiences. Your wedding, your way—designed to make your special day stress-free.",google_places,2026-05-17T23:53:03.347161+00:00,2026-05-18T02:49:22.419564+00:00
ChIJ-2EIYhZ7LIgR13PFf3F5jCA,Troy Farms,"2438 Hwy 5 W, Troy, ON L0R 2B0, Canada",Hamilton,ON,L0R 2B0,(647) 987-7254,http://www.troyfarms.ca/,Wedding Venue,,500,,,+16479877254,farm,in-house only,yes,both,4.8,28,no,yes,http://www.troyfarms.ca/,no,,yes,yes,,,95,"Premier farm wedding venue with dedicated marketing, instant quote system, multiple event spaces with capacities listed, in-house catering, and overnight lodging.","A beautiful farm wedding venue near the GTA featuring outdoor spaces, the rustic Meadow Pavilion, and elegant Garden Marquee with in-house catering and lodging.",google_places,2026-05-17T23:17:07.489867+00:00,2026-05-18T01:15:26.037201+00:00
ChIJCd3BmDUNzkwRU8T1_M0OB64,Oak & Pines Venue,"3310 Tenth Line Rd, Navan, ON K4B 1H8, Canada",Ottawa,ON,K4B 1H8,,https://oakandpinesvenue.com/,Wedding Venue,,,,,,estate,open to outside caterers,unknown,outdoor,5,28,no,yes,https://oakandpinesvenue.com/,no,,no,no,,,92,"This is a dedicated wedding venue with 193 acres, exclusive rental model, and wedding-focused branding prominently featured in the title and description.",Oak & Pines is a private 193-acre estate venue in Navan/Orleans offering exclusive rental where you can hire your own vendors under prairie skies.,google_places,2026-05-18T00:00:19.054171+00:00,2026-05-18T03:11:19.977529+00:00
ChIJFyALZlzzLogRsK4SbVnOZkE,Brookside Banquet Centre,"99 Brookside St, London, ON N5Z 3J6, Canada",London,ON,N5Z 3J6,(519) 641-4725,http://www.brooksidebanquet.ca/,Wedding Venue,,,,,,banquet hall,unknown,unknown,indoor,3.9,28,no,yes,http://www.brooksidebanquet.ca/,yes,The Pearl and The Opal packages available,no,no,,,92,"Dedicated wedding venue with 'Wedding Venue' in title tag, named packages (Pearl and Opal), multiple sections for weddings, menus, and custom options showing strong wedding focus.","Brookside Banquet Centre is a beautiful London, Ontario banquet hall specializing in weddings and celebrations. Offers customizable packages and menus.",google_places,2026-05-17T23:52:17.193825+00:00,2026-05-18T02:45:56.101731+00:00
ChIJa3uL9k7BKogRS_rogJy4m7w,The Glass Manor - Wedding & Event Venue,"5108 County Road 27 R.R.#1, Cookstown, ON L0L 1L0, Canada",Innisfil,ON,L0L 1L0,(705) 305-8457,https://www.glassmanor.ca/,Wedding Venue,,,,,,estate,unknown,unknown,both,5,27,no,yes,https://www.glassmanor.ca/,unknown,,yes,yes,,,95,"Premier wedding venue with 'Wedding & Event Venue' in business name, dedicated wedding venue SEO, micro venue positioning for intimate weddings, rates page, testimonials section, and 4-acre country estate.",An intimate micro wedding venue on a 4-acre country estate in Innisfil. Country-meets-elegance setting with antique furnishings and picturesque grounds.,google_places,2026-05-17T23:32:30.549380+00:00,2026-05-18T02:01:24.292206+00:00
ChIJx50wMqStLIgR8vifusru7_Q,Martin Estates,"5000 Martin Rd N, Lincoln, ON L3J 1H2, Canada",Lincoln,ON,L3J 1H2,(905) 932-3833,http://www.martinestatesevents.com/,Wedding Venue,,,,,,estate,unknown,unknown,both,5,26,no,yes,http://www.martinestatesevents.com/,no,,no,no,,,92,"Premier wedding venue with weddings featured in title, meta description explicitly mentions weddings and special events, 25-acre estate with historic barn, tent, and farmhouse designed for wedding hosting.","Martin Estates is a family-owned 25-acre estate in Beamsville featuring a historic 150-year-old barn, 40'x60' tent, and charming farmhouse surrounded by orchards.",google_places,2026-05-17T23:13:56.323026+00:00,2026-05-18T01:04:47.639786+00:00
ChIJjU9DvaT3zUwR13PnaEsnK7Q,Ashlar Weddings & Events,"2876 Munster Rd, Ottawa, ON K0A 3P0, Canada",Ottawa,ON,K0A 3P0,(613) 883-8116,https://ashlarottawa.ca/,Wedding Venue,20,55,,,,estate,in-house only,unknown,both,5,20,no,yes,https://ashlarottawa.ca/weddings,yes,All-inclusive micro wedding packages starting at $139/guest,yes,no,,,95,"Premier wedding venue with dedicated weddings page, clear all-inclusive packages, transparent pricing starting at $139/guest, and defined capacity for 20-55 guests with heritage venue positioning.",Heritage venue offering all-inclusive micro wedding packages for 20-55 guests with chef-driven dining and full coordination. Packages start at $139/guest in Ottawa.,google_places,2026-05-18T00:00:16.691220+00:00,2026-05-18T03:10:28.159032+00:00
ChIJJaFSfuVB04kRtVLqSS4DDjk,"Gracewood Estates, Kurtz Orchards","16052 Niagara River Pkwy, Niagara-on-the-Lake, ON L0S 1J0, Canada",Niagara-on-the-Lake,ON,L0S 1J0,(905) 468-2937,https://www.kurtzorchards.com/niagara-wed-events/gracewood-estate-wedding/,Wedding Venue,,,,,,estate,unknown,unknown,both,4.6,14,no,yes,https://www.kurtzorchards.com/niagara-wed-events/gracewood-estate-wedding/,no,,no,no,,,92,Dedicated Gracewood Estate wedding page within a known orchard/winery property with clear wedding focus in URL structure and page title.,Gracewood Estate at Kurtz Orchards offers a picturesque Niagara wedding setting surrounded by orchards and vineyards. An elegant estate venue ideal for couples.,google_places,2026-05-17T23:04:40.183388,2026-05-18T00:53:17.894925+00:00
ChIJyysknQqjLogRbD9KaidntoY,Creekside Wedding Ceremony Venue,"295769 29th Line, Lakeside, ON N0M 2G0, Canada",Lakeside,ON,N0M 2G0,(519) 476-2794,http://creeksideweddingvenue.com/,Wedding Venue,,,,,,other,unknown,unknown,outdoor,5,11,no,yes,http://creeksideweddingvenue.com/,no,,no,no,,,95,The venue name itself is 'Creekside Wedding Ceremony Venue' indicating this is a dedicated wedding venue with clear singular focus on wedding ceremonies.,"A dedicated outdoor ceremony venue by the creek. Specialized setting for couples seeking a natural, intimate location to exchange their vows.",google_places,2026-05-17T23:54:37.754913+00:00,2026-05-18T02:59:35.816586+00:00
ChIJ2YfbX1GbJYgRP6a5MRX5en8,Bluewater Weddings Marriage,"1371 Robin Ln, Sarnia, ON N7V 3E6, Canada",Sarnia,ON,N7V 3E6,(519) 332-4800,https://www.bluewaterwed.com/,Wedding Venue,,,,,,other,unknown,unknown,outdoor,5,9,no,yes,https://www.bluewaterwed.com/,no,,no,no,,,95,The venue name and domain itself is 'Bluewater Weddings Marriage' - this is explicitly and exclusively a wedding-focused business.,Bluewater Weddings specializes in creating memorable waterfront wedding celebrations. A dedicated wedding venue focused on bringing your special day to life.,google_places,2026-05-17T23:59:10.445272+00:00,2026-05-18T03:08:01.823607+00:00
ChIJOUB4b_FE04kRzCw6Sll8KsY,"Grandé Ballroom, Americana Resort","8444 Lundy's Ln, Niagara Falls, ON L2H 1H4, Canada",Niagara Falls,ON,L2H 1H4,(905) 356-8444,https://www.americananiagara.com/groups-events,Wedding Venue,,,,,,resort,in-house only,yes,indoor,3.7,7,no,yes,https://www.americananiagara.com/groups-events/weddings,unknown,,no,no,,@americanaresort,92,"Premier resort with dedicated weddings page, clear wedding focus in meta descriptions mentioning elegant décor, fabulous cuisine, and impeccable service specifically for weddings.","Americana Conference Resort & Spa combines elegant décor, fabulous cuisine, and impeccable service to bring your wedding dreams to life in Niagara Falls.",google_places,2026-05-17T23:05:40.722064,2026-05-18T01:01:03.755068+00:00
ChIJf5a2C7bVKogRkb75VLw-mPs,Fox Den Farms Wedding Venue,"13401 Leslie St, Richmond Hill, ON L4E 1A2, Canada",Richmond Hill,ON,L4E 1A2,(647) 444-3268,https://www.foxdenfarmswedding.com/,Wedding Venue,,,,,,farm,unknown,unknown,unknown,5,6,no,yes,https://www.foxdenfarmswedding.com/,no,,no,no,,,92,"The venue name itself is 'Fox Den Farm Weddings' and the domain includes 'wedding', demonstrating this is a dedicated wedding venue with clear focus on the wedding market.",Fox Den Farm Weddings offers a picturesque farm setting for your special day. A charming rural venue dedicated to creating memorable wedding celebrations.,google_places,2026-05-17T23:30:51.357546+00:00,2026-05-18T01:57:33.110562+00:00
